{
  "device_id": "device-test-001",
  "workspace_id": "workspace-test-001",
  "revoked": false,
  "configuration_revision": 3,
  "collectors": {
    "network": { "enabled": true },
    "communication.wechat": {
      "enabled": true,
      "directions": ["incoming", "outgoing"],
      "message_types": ["text", "audio", "image", "video"],
      "conversation_scope": "direct_and_group_at_most_fifteen_members",
      "max_group_members": 15,
      "sync_mode": "full",
      "retention_days": 180
    }
  }
}
